Personal name,D.O.B.,Postcode,E-mail address,Occupation,Random year,Fake text
Dr. Lee Fox,1983-08-13,HS2B 1TQ,teresa72@hughes-cook.com,"Civil engineer, consulting",1992,Natus nesciunt amet dolor inventore.
Jake Jones,1983-09-16,M8 6RL,dhutchinson@brown-graham.com,Radiation protection practitioner,2000,Sint dolorum non minus esse nam.
Brian Parsons,1962-03-29,W67 2AP,thomascameron@hotmail.com,English as a foreign language teacher,2002,Illum quia ex.
Dr. Lesley Sullivan,1974-05-23,W4 4ZA,anne94@gray.com,Administrator,1994,Quisquam dignissimos officiis.
William Mitchell,1990-04-23,CW08 9SZ,fwhite@price.com,Race relations officer,1986,Commodi voluptas et eaque dolor cum.
Sian Martin,1965-10-06,RG0R 6TU,evansgraeme@gmail.com,"Engineer, manufacturing",1991,Dignissimos repellendus ipsam dolorem.
Gillian Wright,1975-12-20,G40 8PJ,garethjenkins@evans.net,"Doctor, hospital",2011,Quasi deleniti quibusdam mollitia.
Mr. Iain Charlton,1950-04-27,LA6Y 6UT,uriley@martin.com,"Surveyor, building",2004,Asperiores magnam quam porro.
Iain Forster,1987-06-20,M5J 1QA,xbradley@leonard.net,Metallurgist,1974,Dicta id ab distinctio.
Ben Murray,1982-09-26,PR6 3DW,smithmatthew@harrison.com,Product manager,1974,Quas cum quas quod.
Shane Roberts,1984-05-21,B15 4UP,uwilliams@yahoo.com,Telecommunications researcher,2007,Saepe vitae cupiditate in.
Scott Pope,1970-02-02,G89 4BH,djohnson@gmail.com,Archaeologist,2000,Facere repudiandae nulla fugiat.
Mrs. Aimee Martin,1970-09-22,W5 3JE,rosievaughan@gmail.com,"Restaurant manager, fast food",1988,Officia distinctio magnam perspiciatis.
Jamie Hale,1983-01-13,B80 3WQ,alexandra59@bolton-brown.com,Waste management officer,1972,Dolorem cupiditate nulla id.
Ms. Gemma Wood,1970-10-12,B6G 4YW,wbaker@carroll.info,"Exhibitions officer, museum/gallery",1972,Reiciendis cumque quod sequi minus.
Heather Richards,1976-12-25,W8 1PL,lstewart@gmail.com,Drilling engineer,1978,Modi quasi laborum tenetur neque.
Adrian Khan,1963-09-14,CB1 2HW,mohammad07@gmail.com,Actor,1996,Commodi quia id iure quod eum.
Karl Dean,1975-12-04,E6E 1UQ,johndawson@wright.net,Electronics engineer,1972,Occaecati occaecati est impedit est.
Denise Cox,1958-09-30,G30 6WQ,sarah85@cox-parker.com,Probation officer,2016,Quos deserunt ut tenetur ad rerum.
Gareth Clark,1956-05-29,HU7 8SX,swilliams@yahoo.com,Retail merchandiser,2005,Eius magni consequuntur sunt rem ad.
Gareth Gray-Gibson,1982-01-24,S5J 8DB,dixonamanda@gmail.com,Oncologist,2008,Ad laudantium sapiente eligendi.
Charlene Harris,1971-05-10,UB36 8ZR,mannkarl@hughes.com,Agricultural consultant,2010,Dicta odio labore perferendis.
Mrs. Yvonne Barnes,1958-04-22,B3 4PE,gwilkinson@pearson.com,Horticultural consultant,1977,Totam odio repellat architecto iste.
Ms. Lauren Potts,1953-01-15,PH1R 6NN,debragordon@gmail.com,Music tutor,1990,Voluptas id cumque labore sed incidunt.
Stephen Williams-Nicholls,1973-05-20,LN0N 9HT,molly63@gmail.com,Youth worker,1995,Placeat numquam dolor.
Russell Slater-Ellis,1956-10-17,E8J 4LY,ywatts@bibi-brown.net,Freight forwarder,2009,Doloribus cum quia corporis ullam.
Russell Whitehouse,1994-03-13,EN37 7GU,lauraharrison@russell.org,Field trials officer,2016,Ut blanditiis minima dignissimos.
Diane Arnold,1993-09-02,CB0X 5HW,roseroy@hotmail.com,Insurance claims handler,2010,Corporis error asperiores cumque.
Brandon Bailey-Pritchard,1949-03-17,N6 7AA,kwright@lee.biz,Music tutor,1984,Nam at ullam.
June Shaw,1986-09-07,N65 0PX,wwilkinson@hall.info,"Radiographer, diagnostic",1995,Neque saepe cupiditate veritatis omnis.
Marie Dixon,1950-02-10,L86 7TS,vincent18@yahoo.com,"Therapist, nutritional",1999,Minima itaque aliquid non tenetur odio.
Dr. Joanna Cooke,1993-06-10,CB5A 9GG,xdunn@hotmail.com,Air broker,1990,Fugit quae illo eum debitis cum.
Ellie Abbott,1981-07-11,SW0 6WG,anne46@hotmail.com,"Psychologist, clinical",2001,Labore minima amet.
Mrs. Olivia Thomas,1974-12-14,S4U 2TL,benjamin00@gmail.com,Wellsite geologist,1999,Molestiae praesentium dolore.
Dr. Gordon Allen,1963-07-02,S87 6PF,bethanoneill@hotmail.com,"Production assistant, radio",1989,Dolore ab eius fugit ratione deleniti.
Dr. Conor Barber,1982-08-07,S1 8DY,xelliott@gmail.com,"Social research officer, government",1982,Ducimus laboriosam quibusdam ipsa.
Abbie Holmes,1982-11-24,W1 8BS,lawrencehargreaves@allan.com,Translator,2012,Totam autem repudiandae delectus.
Dr. Patrick Kaur,1983-07-17,B9 5XW,albert25@hotmail.com,Broadcast journalist,1976,Repudiandae nam magni harum minus.
Gerard Faulkner-Brown,1964-09-10,LD2 5JB,martinkenneth@yahoo.com,Engineering geologist,1971,Magnam eum sapiente doloribus.
Julia Griffiths,1961-05-05,CT3 7GF,rachel21@hotmail.com,Ship broker,1976,Provident delectus distinctio nam.
Toby Jones,1980-01-02,WR63 9SP,leah29@hotmail.com,Airline pilot,1978,Illo quibusdam ut aperiam ab.
Mitchell Pearson,1980-02-18,OL8 0XT,vincent26@yahoo.com,Financial adviser,2017,Est laborum explicabo.
Joanna Gardner,1961-10-12,L6 3ZU,ftaylor@hotmail.com,Archaeologist,1991,Deserunt minus laborum.
Jamie Cook,1980-04-10,E9 6GH,jameshewitt@hotmail.com,Magazine features editor,2008,Modi temporibus sit.
Simon Taylor,1991-08-10,IV91 0WN,mandyfield@hall-ellis.net,Veterinary surgeon,1988,Deleniti dignissimos quas.
Dr. Nicole Cox,1984-12-31,E3 6UT,ataylor@hotmail.com,Advertising copywriter,2008,Facilis animi iste quam perferendis.
Lorraine Doyle-Khan,1973-12-09,L5G 5DB,matthewsdenise@hicks-brown.com,Higher education careers adviser,2014,Ex natus dicta.
Mr. Alex Birch,1966-06-17,BN14 3TB,mohammadbull@gmail.com,IT consultant,2017,Voluptatum nam beatae quibusdam porro.
Tracey Thompson,1992-09-26,TR2X 9NJ,frederickevans@johnston.com,Outdoor activities/education manager,1981,Modi dolores dolore totam.
Miss Jade Taylor,1961-11-23,EH7 4BZ,mauricebarnes@yahoo.com,"Sound technician, broadcasting/film/video",1994,Placeat sint occaecati ut magni cum.
Dr. Bradley Cross,1954-05-06,M03 8BR,burkebradley@jones-preston.biz,Graphic designer,2003,Inventore sed temporibus sed a eos.
Maria Jones,1952-04-29,S7 3SS,wprice@riley.com,Biomedical engineer,1995,Soluta maiores maxime ab.
Jenna Lloyd,1994-03-22,E4 5ZB,cmason@jackson.com,"Teacher, English as a foreign language",2001,Amet vitae sequi maxime.
Amy Robinson,1986-10-22,JE6B 8RY,vatkins@wallace.com,"Teacher, music",2018,Vero pariatur doloribus neque.
Denise Hancock-Davidson,1968-02-28,IM8 1TH,wardmarian@connor-pollard.org,"Runner, broadcasting/film/video",2002,Culpa id repellat alias eum voluptate.
Brett Pickering,1961-12-23,S5G 0DH,toby10@yahoo.com,Environmental education officer,2019,Laborum earum consequuntur voluptas.
Ms. Sandra Taylor,1989-11-11,PA9 4ZR,fletcherthomas@curtis.com,Paediatric nurse,1973,Dolorum libero porro laboriosam.
Miss Geraldine Ward,1969-10-13,KW73 4YY,rachaelfranklin@cook-chamberlain.info,"Engineer, drilling",1999,Eaque aliquam beatae saepe error.
Denise Patel,1980-06-28,M63 9TL,smithmary@yahoo.com,Local government officer,1992,Quasi eaque architecto magni.
Sharon Whittaker,1982-02-11,DT29 9UW,sean86@gmail.com,"Designer, ceramics/pottery",2003,Aperiam labore aliquam.
Kayleigh Willis,1986-09-30,BH2 5WD,mwhite@gmail.com,"Geologist, wellsite",2008,Magni quas dolores.
Grace Storey,1958-12-31,M2K 4HU,nlamb@roberts.com,Art therapist,1990,Unde animi cum quia.
Anne Carroll,1984-01-11,NN26 2JJ,sholmes@walters-francis.info,Nature conservation officer,1971,Inventore vitae dignissimos laboriosam.
Henry Jones,1987-02-28,EX91 3XL,kwright@alexander.info,Sports coach,1996,Vel optio veritatis deserunt.
Jennifer Banks,1949-03-12,SP6 1SA,gilbertrosemary@roberts.com,"Designer, graphic",2018,Provident et nulla.
Dr. Daniel O'Sullivan,1968-03-17,EX89 2PZ,irenefrancis@gmail.com,"Surveyor, commercial/residential",1992,Aliquam ad ipsum doloribus.
Miss Hazel Arnold,1983-11-23,ME04 7WU,egregory@barker-williams.com,Systems analyst,1983,Magni nihil corrupti praesentium harum.
Mr. Kenneth Jones,1957-12-12,WS5E 1GB,cooperchristian@hotmail.com,Actuary,2015,Soluta at pariatur enim ea.
Kate Brown,1991-07-25,W3U 0RT,hwong@gmail.com,Furniture conservator/restorer,1970,Accusantium saepe amet.
Hilary Williams-Morris,1977-01-31,L3 1JE,guyknowles@hotmail.com,"Surveyor, mining",1984,Tempora aut modi dolorum.
Annette Macdonald,1961-06-14,M75 8XU,barrysam@yahoo.com,Podiatrist,1999,Alias modi doloribus nesciunt.
Jeffrey Bartlett,1971-10-21,E4K 0DL,jeremy45@hotmail.com,Estate agent,2010,Possimus officia vero vero.
Guy Smith,1963-03-31,BH8 0QR,lindsey82@horton.com,"Engineer, manufacturing systems",2013,Ipsam natus cumque praesentium.
Anna Nicholls,1975-05-22,SL0E 3JF,dhughes@hotmail.com,Clinical research associate,1988,Repellat officiis facilis.
Jennifer Kay-Martin,1960-01-08,M2 4EG,julianprice@davey.net,Land,1990,Aperiam sed praesentium.
Jordan Bentley,1958-01-08,E5F 2TU,jonesneil@bishop.com,"Librarian, academic",1986,Voluptatibus harum modi at.
Valerie Quinn-Butler,1986-09-22,B1 1RQ,paynealbert@powell.com,Office manager,1973,Ea fugit inventore vitae.
Timothy Armstrong,1987-07-10,B0 4PJ,csmith@cox-mills.com,Contractor,2017,Placeat ipsa voluptatem rem.
Allan Shah,1956-06-05,NW2 0AE,amy28@gill.info,Camera operator,1984,Nisi commodi doloribus eos atque.
Wayne Mahmood,1960-07-31,NG8N 1SD,xallen@yahoo.com,Medical laboratory scientific officer,1998,Repellat quas accusamus voluptate.
