Personal name,D.O.B.,Postcode,E-mail address,Occupation,Random year,Fake text
Lynda Evans-Dodd,1972-04-10,E5K 2AB,gemmaryan@yahoo.com,Community development worker,1999,Saepe provident doloribus quaerat.
Mrs. Pauline McDonald,1994-09-04,DN6 0UY,billytodd@hotmail.com,"Engineer, aeronautical",1991,Similique vero eos sit ab.
Dr. Bethan Jackson,1979-08-26,L11 7NS,mohammad05@begum.com,Merchant navy officer,1993,Iste atque minima accusamus.
Jodie Woods,1968-02-18,S94 3FJ,nigel67@hotmail.com,Chief Financial Officer,1992,Laborum architecto id.
Mrs. Jacqueline Sullivan,1949-07-22,B7 5DD,annhunt@yahoo.com,"Accountant, chartered",2004,Impedit ducimus provident ipsam ab a.
Dr. Catherine Cooper,1991-12-10,PO63 4FP,balldanielle@preston.info,Fish farm manager,1979,Asperiores eaque expedita sint.
Danny Rose-Martin,1969-04-09,B7E 6SU,rthompson@walker.net,Amenity horticulturist,2019,Ea fugiat dicta deserunt.
Mr. Martyn Collins,1994-03-06,CF38 0XF,mandy57@martin.net,Claims inspector/assessor,2016,Eius pariatur fugit delectus.
Darren Summers,1955-07-01,BN7Y 5UT,mathew18@yates.net,Insurance underwriter,1970,Doloribus soluta dicta itaque quam.
Dr. Patrick Jones,1977-01-29,PA8V 6NF,karenkerr@davies-blake.biz,"Engineer, drilling",2002,Possimus commodi ut vitae sit enim.
Julia Dickinson-Stephens,1975-01-24,DA85 8DH,hallmargaret@walker-matthews.com,Primary school teacher,2001,Possimus et sapiente maxime.
Mrs. Denise Gough,1963-11-17,G6T 7LG,emmawatson@gmail.com,Academic librarian,1991,Laborum repellendus modi facilis ipsa.
Miss Teresa Brown,1956-08-18,B4 9EJ,lukecooper@gmail.com,Cytogeneticist,1974,Et ex animi tempore at.
Sophie Hill,1979-03-10,KT9Y 4AS,xhyde@hotmail.com,Actuary,1994,Adipisci magni rem ex modi sit.
Mr. Hugh Fuller,1992-08-08,N0H 2WQ,leonardfletcher@parsons-roberts.info,Retail buyer,1999,Tempora minima nesciunt.
Ms. Sharon Hughes,1982-03-24,S6U 8QY,williamstracey@poole-jones.com,Patent attorney,1970,Laboriosam totam quo cum consectetur.
David Taylor-Thomson,1970-09-01,N82 0SJ,payneian@gmail.com,"Surveyor, land/geomatics",1975,Enim atque minima voluptatem amet.
Miss Geraldine Gray,1963-11-30,LA9Y 5ZB,webbmarion@scott.com,Research scientist (medical),1981,Veniam ex temporibus asperiores.
Kieran Roberts-Harrison,1973-04-28,S0K 9GA,mortonkelly@johnson-williams.com,"Engineer, energy",2003,Commodi id eum maxime.
David Lord-Osborne,1969-04-15,BH5A 3UU,melaniewalsh@hotmail.com,"Designer, television/film set",1988,Non consequuntur numquam.
Miss Abigail Turner,1973-01-22,DE3 5PZ,jonesjill@lewis-steele.com,"Lecturer, higher education",2001,Molestias accusamus eaque.
Mr. Donald Watson,1985-05-27,FY4 1XB,nigelrobinson@barrett.com,"Surveyor, building",2003,Veritatis hic tempora ipsum nulla quae.
Dr. Iain O'Donnell,1992-02-25,N64 5DD,leahking@brown.com,Restaurant manager,2000,Sequi et est velit beatae laboriosam.
Deborah Cook,1992-04-24,B5 3GF,victorclark@hotmail.com,Environmental education officer,2003,Placeat provident illo voluptatum.
Kathleen Baker-Flynn,1949-04-29,SS0R 8AP,prhodes@hotmail.com,"Therapist, speech and language",2014,Temporibus illum optio expedita earum.
Marie Robinson,1963-12-27,WR71 1UJ,greencameron@yahoo.com,"Designer, graphic",2011,Dolore ut in iusto.
Lewis Brookes,1989-05-24,CO54 8UX,frank75@glover.net,Arts development officer,1996,Dignissimos possimus eum dignissimos.
Jill Morris,1977-10-21,DY8 8RD,ajones@yahoo.com,Education administrator,1976,Illo fuga quo eos aliquam.
Mrs. Lauren Hall,1981-04-26,LD3X 6DL,anthonycurtis@hill.com,"Scientist, biomedical",1998,Incidunt eos ratione sunt.
Melanie Jones,1987-01-07,E62 0TG,gemma09@yahoo.com,Seismic interpreter,1989,Excepturi libero dolorum facere.
Megan Blake,1989-11-10,B41 3DY,duncan40@yahoo.com,Architectural technologist,1976,Dolorem doloribus consequatur soluta.
Marian Harris,1974-07-04,G8 2FL,gardnerglen@harrison.com,Horticultural therapist,1972,Quo aliquid ratione provident.
Clifford Lyons,1983-07-05,L89 7EH,mgould@yahoo.com,"Engineer, aeronautical",2014,Doloribus a libero odit.
Bethan Day-Wall,1992-03-27,L6 6FR,lynchfrances@daniels.com,Information officer,1970,Atque ullam eum necessitatibus placeat.
Katherine Marshall-Bell,1980-06-06,G2 9FX,charleshardy@gmail.com,Surgeon,1978,Excepturi repellat molestias magni.
Declan Kelly,1980-03-31,SG49 8AW,lawrencepearce@gmail.com,"Psychologist, occupational",1994,Explicabo sit explicabo rerum eveniet.
Mr. Stewart Johnson,1971-02-12,FY92 0AN,jfoster@hotmail.com,"Teacher, music",2008,Et rem quisquam quasi esse.
Brenda Knowles,1984-12-09,S3 0LD,johnsamuel@hotmail.com,Equality and diversity officer,1980,Modi omnis voluptatem nesciunt.
Jacob Allen,1953-08-23,M7D 5QB,stephensutton@white-smith.com,Aeronautical engineer,2011,Soluta laboriosam asperiores sit est.
Henry Parker,1976-02-09,RM46 4YL,catherine02@ali-ball.info,Dance movement psychotherapist,1987,Eaque eius ipsum commodi assumenda.
Mr. Leigh Wright,1981-04-23,TQ9X 0TX,ugreenwood@hotmail.com,Animator,2001,Consectetur earum minus.
Maria Wood,1994-05-24,S20 8WG,watsonalexander@hotmail.com,Phytotherapist,2015,Natus neque nisi perspiciatis.
Daniel Hall,1980-10-10,HA9E 6BW,burtonadam@thomas-potter.com,Facilities manager,1989,Aspernatur culpa nesciunt saepe nisi.
Wendy Baker,1960-06-24,S0S 6EY,stewartwilkinson@harris.com,Medical technical officer,2014,Corrupti temporibus repellat.
Mr. Martyn Bentley,1962-02-09,S6H 0UE,danny60@hotmail.com,Tourist information centre manager,1971,Delectus rem quasi.
Dr. Charlie Davis,1950-08-07,G40 3AD,ewest@hotmail.com,"Administrator, arts",1991,Dolor cupiditate iure deleniti esse.
Tom Holland,1986-04-25,E6W 4YS,cameron75@gmail.com,Risk manager,1973,Modi delectus culpa nisi.
Mr. Joseph Green,1988-11-22,L5 5ZD,olivercharlton@taylor.info,Naval architect,2009,Accusantium quo sed.
Dr. Harry Leonard,1989-06-15,W2A 6FB,mohammed92@goddard.com,Barrister,1976,Molestias eos illo suscipit.
Yvonne Robinson,1956-03-03,NW8Y 3SY,bbrown@mcdonald.net,Charity fundraiser,2007,Fugiat error ea corrupti quam minus.
Dr. Ellie Whittaker,1967-01-25,S3E 9NE,raymondfoster@yahoo.com,"Embryologist, clinical",1971,Amet quasi accusamus atque id deleniti.
Elizabeth Dodd,1971-05-17,S70 0BQ,roybooth@yahoo.com,Interpreter,1998,Cumque quam eos laborum tempore.
Lindsey James,1979-01-14,E34 0AG,brucebryan@gmail.com,Camera operator,1994,Facilis perspiciatis facere laboriosam.
Mr. Colin Austin,1949-03-08,S3 5DX,jemmareid@hussain.net,General practice doctor,1983,Aperiam a nesciunt voluptate.
Bernard Harris-Smart,1966-12-12,S9 8TF,howardblackburn@walker-wood.net,Fashion designer,2007,Fugiat in tempora quaerat nam quae.
Declan Williams,1953-03-21,N3C 1DR,simpsonmelanie@bennett.biz,Theme park manager,2002,Iste reiciendis maiores aut.
Peter Wright,1977-05-02,M8 0QJ,glennbrown@king-davies.com,Freight forwarder,1980,Necessitatibus minima optio deserunt.
Elliott Jones-Patel,1984-10-04,LU5X 0XU,arthurstanley@yahoo.com,Contractor,2003,Voluptatem quod natus nesciunt.
Ann Lord,1983-06-01,S8 2PL,jstone@gmail.com,"Teacher, primary school",1991,Amet suscipit qui dicta.
Terence Carroll-Carpenter,1956-09-16,N8 0ZE,amywatts@yahoo.com,Food technologist,2002,Ducimus nihil vitae.
Clifford Harris,1960-03-12,S8K 9NB,edwardmarshall@reed-jones.biz,Operational investment banker,2001,Repellendus laboriosam eos.
Mrs. Julie Davidson,1981-11-19,B1E 1DH,fcameron@bowen.info,Commercial horticulturist,2009,Harum autem asperiores molestias.
Ross Begum-Evans,1977-05-21,DN4E 8RU,lmiah@hotmail.com,Bonds trader,2019,Sunt unde quidem iure totam.
Miss Diane Harvey,1973-04-30,BH74 5DX,amelia32@gmail.com,Environmental education officer,2009,Quo autem praesentium totam.
Dr. Frank Young,1962-11-24,N4 1GE,payneelizabeth@gmail.com,Environmental health practitioner,2005,Alias dolorem ducimus pariatur.
Samuel Taylor,1988-06-07,B49 8NG,lynndaly@yahoo.com,"Librarian, academic",1973,Illo eveniet ex minus nobis enim.
Aimee Gallagher,1967-06-09,G35 2LL,zoe50@leach.biz,Meteorologist,2010,Fugit repellat exercitationem minima.
Sharon Sullivan,1986-02-21,W4 6WS,coxellie@hotmail.com,Occupational hygienist,2014,Ex corporis incidunt enim iusto.
Mrs. Charlene Frost,1990-05-07,G8S 4RH,daviesmarie@yahoo.com,Primary school teacher,1995,Ea doloremque minima at.
Andrea Hall,1963-08-27,E6 6ZU,sally01@hotmail.com,Corporate investment banker,1983,Explicabo corrupti consequatur velit.
Andrew Dale-Pearson,1979-01-21,G24 8WJ,josephine56@taylor-randall.info,Community development worker,1974,Culpa labore est a quam.
Dr. Rachael Kirby,1979-10-22,UB2 1DF,kellygordon@reid.com,"Sound technician, broadcasting/film/video",2003,Repellat ratione corporis velit.
Miss Teresa Baxter,1987-06-29,B29 3GP,ldavies@yahoo.com,Health service manager,1989,Soluta asperiores quisquam autem.
Dr. Shirley Robinson,1963-11-09,G2D 4WE,thompsonlesley@gmail.com,Dietitian,2016,Minima est voluptates saepe maiores.
Mandy Patel,1988-07-22,E3K 5WW,ewalsh@hanson.net,Advertising account planner,1992,Labore voluptates esse.
Michelle Richards,1985-09-10,S0S 7NW,lparsons@gibson.com,"Engineer, production",1974,Officia aperiam ullam totam fuga.
Samantha Fletcher-Payne,1983-10-01,FY26 0FB,sianburke@hotmail.com,Dance movement psychotherapist,1978,Quia nemo distinctio ipsum.
Mrs. Anna Williams,1974-05-02,M4E 4XX,damien35@hamilton-roberts.com,"Physicist, medical",2012,Cum perferendis aliquid voluptatibus.
Denis Dunn,1977-07-21,G02 3GT,qfowler@hotmail.com,Pension scheme manager,1986,Non sed exercitationem ipsum.
Ms. Bethany Booth,1977-07-18,PH2 3PR,antony02@hart.org,Clothing/textile technologist,1980,Aliquid natus vel nemo ad at atque.
Leslie Duffy-Smith,1974-03-28,BL06 2RZ,tellis@gmail.com,Patent examiner,2012,Quaerat accusamus illo quia.
Leanne Gibson,1976-09-09,E9 8TR,daviesglenn@price-davies.org,Contracting civil engineer,2007,Cum velit et numquam consequuntur.
Ms. Charlotte Howarth,1988-10-11,WC7 0FY,evansbradley@hotmail.com,Materials engineer,2006,Enim laborum molestiae minus qui.
Keith Barnes,1972-11-20,CB2B 7YQ,lawrence74@yahoo.com,"Production assistant, radio",2010,Suscipit aliquid atque.
Ms. Chloe Banks,1964-08-20,HD52 5WP,tmitchell@gmail.com,Adult nurse,1971,Deserunt dicta ut fugiat nobis.
Dr. Holly Patel,1988-03-02,DG42 3EW,daniellambert@hotmail.com,Medical laboratory scientific officer,2012,Atque vero esse quidem.
Damien Russell,1992-04-18,S7F 6RX,wbyrne@hotmail.com,Primary school teacher,2004,Exercitationem sunt non inventore.
Mrs. Chloe Scott,1977-08-13,W7D 2FJ,bradleyellie@gmail.com,IT technical support officer,1977,Maxime aliquam ipsam.
Mr. Kieran Waters,1994-02-28,M14 9GJ,uelliott@marshall.com,TEFL teacher,1972,Aperiam quo veritatis.
Timothy Pearson,1965-11-30,TD8 0YZ,maria19@davis.com,"Physicist, medical",1999,Ut dolores a sit maxime.
Hugh Dennis,1967-11-25,L2 8QS,khanjune@patel-duffy.com,"Engineer, energy",1993,Ea id vel ad voluptatum.
Dawn Jones,1954-02-21,PA6H 0HT,powellrita@hotmail.com,Lobbyist,1999,Illo ad enim illum nam eaque facilis.
Dennis Naylor-Webb,1987-06-25,L0 4NS,margaret31@yahoo.com,Hydrogeologist,2009,Ex architecto iusto nulla voluptatum.
Dr. Michael Smith,1964-08-15,L7 3RL,kate45@holloway-james.biz,"Horticulturist, commercial",1989,Ipsa blanditiis tempore.
Ms. Maureen Robinson,1986-03-06,B34 8PA,nigelroberts@gmail.com,Exercise physiologist,1983,Cum veritatis atque laborum omnis.
Marian Richards,1958-01-11,RM8 3DL,clarkhelen@gmail.com,"Therapist, sports",1991,Consectetur ipsum sed esse.
Francis Ford,1990-07-14,L8 0JL,gemma01@watson-nelson.com,"Geologist, wellsite",1996,Eaque eaque quae officiis.
Adam Wilkins,1978-07-28,ZE7 0HY,evanslinda@hotmail.com,Police officer,2001,Quo aut eos aspernatur quidem dolor.
Mr. Tony Smith,1983-08-06,N5D 6XN,phooper@gmail.com,Stage manager,2003,Nulla inventore sed ducimus laboriosam.
Jacqueline Allen-Blackburn,1961-03-25,DY19 8AG,jasmine28@gmail.com,"Engineer, automotive",1971,Libero cupiditate consectetur a.
Lorraine Lowe,1981-05-14,IV19 5UN,rjarvis@watson.net,"Research officer, trade union",2014,Minus magni illum labore vitae.
Amy McCarthy,1965-12-31,N9K 9TS,kerry02@hotmail.com,Chartered loss adjuster,1986,Eius quisquam perferendis.
Kathryn Brady-Gray,1968-03-05,AB4B 1WE,sali@lewis.biz,"Scientist, clinical (histocompatibility and immunogenetics)",2002,Nisi voluptatum deserunt.
Bradley Harris,1967-12-07,WR0R 8EH,lawsonjoanne@french-thomson.com,Horticultural therapist,1988,Facilis cumque libero.
Hugh Lawson,1973-08-06,M57 1QF,bpatterson@hotmail.com,Illustrator,1990,Non perspiciatis necessitatibus.
Gordon Perry,1976-07-09,KY8 4RH,lyndaroberts@hotmail.com,Personal assistant,1984,Sed sint eligendi odio.
Holly Williams,1994-09-05,L7 5NU,vstephens@gmail.com,Health and safety inspector,1992,Quis recusandae est voluptas eius.
Paul Cole,1984-02-17,E0T 0YQ,gbell@gmail.com,Fish farm manager,1989,Necessitatibus quia laborum a ad.
Ms. Rosie Humphries,1983-07-23,LS51 7HZ,dawnfox@gmail.com,Associate Professor,2002,Mollitia aut et.
Kyle Hodgson,1981-07-27,MK0W 5XE,manningmaria@evans.com,IT consultant,2016,Enim corrupti magni.
Andrea Fisher,1964-12-22,BT00 0QJ,daleclarke@atkinson.net,"Engineer, energy",2000,Error architecto itaque.
Geoffrey Williams,1985-09-23,W1F 7HQ,vjohnson@yahoo.com,"Programmer, applications",1990,Numquam nemo quam id maiores atque.
Judith Bennett,1986-04-01,PA1 1PE,greengeoffrey@hotmail.com,Adult nurse,2013,Iusto corrupti ex enim.
Marcus Pearson,1986-08-10,S14 7UU,allan23@yahoo.com,Make,1989,Facilis deleniti quae tempore iste.
Dr. Holly Hughes,1976-06-10,L3H 4PL,ifraser@gibbs.info,Lobbyist,1977,Cum soluta blanditiis quaerat.
Miss Irene O'Brien,1971-07-19,FK7E 0NA,paullees@atkins.com,Television camera operator,2011,Quis repellendus neque vel laudantium.
Jake Shepherd-Baker,1959-12-31,L2 3UJ,holliemartin@james.com,"Teacher, adult education",2011,Blanditiis cumque rerum aspernatur.
Dr. Adam Tucker,1973-02-11,G5 8FQ,dale45@yahoo.com,Licensed conveyancer,1993,Voluptas a sed perspiciatis.
Carly Martin-Dickinson,1983-03-26,W6 7BB,walshwayne@yahoo.com,"Designer, exhibition/display",2009,Est consectetur accusantium delectus.
Damian Gordon,1950-04-05,TR05 6WQ,zyoung@yahoo.com,Local government officer,1996,Doloremque dignissimos quod maiores.
Dominic Hughes,1985-03-14,L06 5YB,ghunter@yahoo.com,"Engineer, maintenance",1976,Ea aliquam incidunt nisi veritatis.
Dr. Gerard Marshall,1972-06-23,G5F 1SG,gordon16@gmail.com,Tree surgeon,1999,Aliquam laudantium maxime.
Dr. Frank Taylor,1986-11-01,EH4P 8BE,zreid@khan-armstrong.com,"Producer, radio",2018,Aliquid ut perspiciatis eum eos.
Lynne Arnold-Clark,1990-01-19,DN47 8EG,pricejulie@yahoo.com,Trade mark attorney,1999,Expedita delectus ex laudantium cumque.
Clifford Dodd-Gibson,1991-07-16,G0F 3LA,coleconor@yahoo.com,Airline pilot,1995,Quam nostrum recusandae in laboriosam.
John Rahman,1973-12-12,GY6 4JH,guysullivan@williamson.org,Armed forces operational officer,2003,Soluta ratione repudiandae.
Tony Hargreaves,1970-06-06,OX53 4NH,hallamber@yahoo.com,Audiological scientist,1993,Magni accusantium veniam architecto.
Clive Schofield-Grant,1959-12-30,WF99 6NS,danielle54@hotmail.com,Forensic scientist,1986,Alias quod corrupti ullam nulla.
Margaret Chapman,1990-08-02,HA35 1HT,jacob92@adams-carroll.com,Pathologist,2019,Magni provident pariatur nemo.
Ms. Sarah Williams,1975-05-27,W17 8TG,jacob99@hotmail.com,Site engineer,1990,Vel fugit repudiandae fuga odio dolore.
Daniel Jones,1988-10-11,HA60 4YX,rowleyclive@hotmail.com,Data processing manager,1990,Fuga assumenda quos ratione.
Adam Walters-Evans,1981-02-14,M3 7TE,rickyjohnson@hotmail.com,Health visitor,1974,Unde architecto odio soluta quis.
Dr. Tracey Jones,1958-12-31,WA3R 3LQ,paige77@hotmail.com,"Scientist, research (life sciences)",1999,Quasi veritatis at adipisci iure quasi.
Lucy Smith,1969-08-03,S7 4EL,hallmartin@holmes.com,Psychiatrist,1989,Possimus ab quo.
Gary Jenkins,1981-07-17,DL1 2JL,davidhawkins@morris.info,"Buyer, industrial",1992,Rem vitae commodi natus nobis.
Martyn Perry,1973-07-26,G9H 1GP,meganhewitt@hotmail.com,Marketing executive,2014,Voluptatum impedit reiciendis.
Dr. Neil Ali,1962-10-09,SP1 1AS,taylordale@yahoo.com,Technical author,1977,Alias quod quo ratione.
Gillian Riley-Mitchell,1977-04-14,G6S 7FG,allanbaxter@barnes-morris.com,"Engineer, civil (contracting)",2014,Placeat est aliquid veniam esse eos.
Ms. Susan Brown,1979-01-05,G5 2YZ,jemmaalexander@hotmail.com,Outdoor activities/education manager,2001,Nisi natus eveniet deleniti voluptatem.
Dr. Elaine Cook,1957-06-15,HD0 0ZN,millerharriet@hotmail.com,Exercise physiologist,1978,Maxime ex odio explicabo.
Justin Griffin,1956-07-06,BT7E 1PW,gallaghercatherine@hotmail.com,Soil scientist,2012,Natus saepe numquam odio.
Allan Middleton,1982-03-11,WV5 1XZ,zwilliams@gmail.com,"Nurse, adult",1997,Fugiat dolore in velit error.
Dr. Jodie Richards,1957-02-15,BL24 4XS,traceysaunders@hotmail.com,English as a second language teacher,2010,Quis magni vel tenetur.
Mr. Conor Shaw,1970-02-19,PO83 9HY,ryan44@yahoo.com,"Engineer, electronics",1973,Accusantium omnis occaecati sed.
Hilary Brown-Richards,1990-09-11,PH7 9GL,yarmstrong@gmail.com,Advertising copywriter,1996,Ratione id labore consequatur.
David Williams-Bell,1976-05-16,E01 8PE,williamsalex@gmail.com,"Administrator, Civil Service",1991,Non minima sed labore deserunt.
Charlie Atkinson,1962-02-20,N5T 4DW,barrywood@gmail.com,Camera operator,1971,Quaerat accusamus incidunt dicta.
Dr. Graeme Clayton,1966-11-25,WS1 6ZE,gclark@evans-graham.com,"Surveyor, land/geomatics",1998,Nemo voluptas tempore blanditiis.
Nathan Wilkins,1951-10-27,LL3 3PY,zoebarlow@gmail.com,Ophthalmologist,2000,Soluta accusantium cupiditate hic.
Grace Kaur,1974-06-28,BS7 9GH,simpsondeclan@gmail.com,"Engineer, civil (consulting)",2012,Eius debitis sed.
Leigh Clarke,1959-06-18,JE0B 9LP,katytaylor@yahoo.com,Race relations officer,1983,Vero beatae a officiis voluptatibus.
Frederick Clarke-Baker,1987-01-18,DA6 5GB,caroline81@green-shaw.info,Sales promotion account executive,1980,Quos quae qui.
Nigel Thorpe,1971-01-07,TA86 5WE,prestongarry@gmail.com,"Surveyor, building control",1989,Eum dignissimos debitis veniam facere.
Nathan Turner,1949-07-12,BR1W 8HJ,lcooper@allen.com,"Engineer, chemical",1982,Cumque quas sed quis.
Dr. Ian Simmons,1971-10-08,BH34 8LZ,denise56@hotmail.com,Television floor manager,2000,Dolores ab fugiat.
Ms. Shannon Reid,1978-01-24,KT3 9UX,grantmolly@dodd.com,Charity fundraiser,1997,Ducimus vel vel facere quas.
Miss Rachael Wood,1963-09-23,B63 6UA,zevans@wilson.com,"Scientist, product/process development",1988,Repellat maiores nulla accusantium at.
Miss Maureen Hall,1983-09-16,WA4N 9SW,rriley@fox-mellor.com,Careers adviser,1976,Totam id ipsam officiis.
Kim Ali,1962-12-01,W55 6LU,zwood@hotmail.com,Financial planner,1974,Aut natus ipsa hic.
Justin Cameron-Bryant,1988-07-14,GU79 1WE,holliejones@hotmail.com,"Librarian, public",1972,Hic in beatae facilis fugiat vitae.
Aaron Stokes,1968-10-02,M67 2TB,flynnlisa@khan.com,Arts development officer,1974,Quibusdam fugit doloremque.
Clare Sharp,1976-02-28,W4 4HT,barbara16@hotmail.com,Architectural technologist,1998,Quia autem eaque possimus.
Leonard Howell-Hudson,1960-08-24,M83 9HN,margaret65@poole.net,"Education officer, environmental",1970,Quis eos maxime.
Dr. Charlene Archer,1975-12-30,LS05 4FJ,brandon86@gmail.com,"Geologist, wellsite",1985,Voluptas veniam facere.
Mr. James Webb,1968-06-30,WR4 1EX,carrollowen@harrison-shaw.com,Operational researcher,1995,Deserunt rem accusamus explicabo.
Julian Willis,1992-10-09,LA5N 8GE,elliot49@taylor.com,Tax adviser,1970,Vero dolor expedita recusandae.
Teresa Johnson,1979-08-15,L67 3EG,njenkins@hotmail.com,Statistician,2002,Non ratione ad laudantium.
Luke Morley,1957-09-05,RH9 6ZL,andrewsirene@savage-collins.net,Acupuncturist,1979,Dolorum quam voluptatibus voluptatem.
Mr. Timothy Taylor,1959-04-14,DY20 0RY,kevinlittle@connolly-ingram.com,Music therapist,1997,Molestiae excepturi velit amet.
Denis Clarke,1983-06-12,G2 5AY,jamesgill@yahoo.com,Clinical cytogeneticist,2005,Rerum id reprehenderit.
Jordan Kaur,1994-03-22,FY2B 8EH,kelly63@nash.com,Mudlogger,2012,Harum eos labore excepturi.
Dr. Joel Mills,1981-01-25,ML3V 4ED,anthonyfletcher@wilkinson.biz,"Embryologist, clinical",2007,Numquam commodi illo iure iure.
Dr. Jake Warner,1972-08-18,M7 6DP,sbolton@clarke.com,Health visitor,2006,Amet tenetur eum quae cum vel minima.
Kirsty Cook,1956-03-20,G56 7DT,tsharp@yahoo.com,Speech and language therapist,1971,Atque placeat dolores ratione.
Rhys Barrett,1969-09-06,CO6M 2TD,summerssimon@brown.com,"Chemist, analytical",1975,Suscipit sint voluptatem doloribus.
Mrs. Lesley Gray,1970-01-12,CH1X 7TB,brett85@gmail.com,Patent attorney,1977,Accusantium at fuga fugit eos.
Julian Carter,1963-11-02,W1 3QQ,pknight@hotmail.com,Photographer,2000,Voluptatum facilis odio nemo.
Dr. Ricky Griffiths,1960-03-07,L1J 8GB,rwoodward@chapman.com,Sports coach,1995,Non vero quisquam rem.
Douglas Norman,1993-12-07,W94 1DH,prattmelanie@robertson-wilson.com,Surgeon,2012,Accusamus ab in maxime inventore rerum.
Samuel Wilson,1984-07-06,AB83 9BY,freemandamian@hurst-farrell.com,Plant breeder/geneticist,2019,Ipsa ratione magni libero doloribus.
Jean Harris,1959-02-25,E66 7FX,francesca65@hotmail.com,Estate manager/land agent,1998,Sunt ab quasi voluptatem eos.
Ashleigh Hill-Wilkins,1971-12-03,N3 6ZG,peterbooth@kirby.org,Chiropractor,2011,Dolore a ipsum placeat qui.
Jane Bennett,1959-10-18,HA0 0NT,fletcherkelly@barnett-jones.com,"Copywriter, advertising",1989,Doloribus illum adipisci.
Mr. Eric Barker,1992-11-10,W0 1TR,thomasbaxter@kelly.org,Chief Strategy Officer,2004,Assumenda illo quis qui.
Charlotte Donnelly-Brown,1979-01-19,WN9 2QA,birdelliot@gmail.com,"Psychologist, sport and exercise",2006,Quasi esse aut culpa.
Mr. Martyn Price,1976-01-17,SE0 0FT,jacobcrawford@yahoo.com,Special educational needs teacher,1983,Nihil odio esse animi ut beatae.
Jack Clark,1976-10-08,PR4 0WQ,henry12@burton.info,Research scientist (maths),2005,Maxime aut nesciunt.
Geraldine Lloyd,1963-10-15,L0C 0JE,martyn43@morgan.biz,"Education officer, environmental",1975,Aut voluptatum architecto.
Denise Walker,1963-03-20,WC4N 7GG,boylemelissa@begum.com,Forest/woodland manager,1987,Illo fuga impedit similique ipsam.
Mr. Colin Gough,1970-12-04,RG1 8XA,fishersamuel@evans.com,Data processing manager,2005,Cupiditate qui maiores reprehenderit.
Liam Holt,1969-03-05,ME94 7HE,kathleenwallace@yahoo.com,Actuary,1988,Temporibus nam fugit animi fugit sed.
Dominic Davis,1974-06-11,TR85 4ZN,dennis24@saunders-george.com,Armed forces training and education officer,1987,Magnam saepe hic incidunt.
Mr. Ian Smith,1958-08-03,NR6M 9TJ,elliotwilliams@carey.biz,Contractor,1986,Illum numquam soluta velit.
Hayley Watson,1965-04-06,M43 5TH,carly63@gmail.com,Health physicist,1995,Amet molestiae quod inventore fugiat.
Arthur Shepherd-Sutton,1986-09-04,G6G 0AF,damiengray@yahoo.com,Education administrator,1975,Labore corrupti quod culpa.
Kerry Alexander,1969-03-10,E7 9TU,lambertann@gmail.com,Social worker,2012,Eveniet eaque aperiam a quas.
Mr. Neil Hewitt,1963-05-08,L9 7YZ,kdavies@read-moss.org,Technical brewer,1998,Distinctio eum quia sapiente amet.
Mrs. Marilyn Bailey,1993-05-01,HP2R 9EB,terencefaulkner@hargreaves.com,Travel agency manager,1976,Quasi odit sapiente omnis fuga.
Aimee Mason,1986-05-04,EX5W 8WN,thomsonjudith@gmail.com,Optometrist,2017,Enim molestias id vitae labore.
Joel Johnson,1964-12-07,E45 0YN,pcook@gmail.com,Housing manager/officer,1980,Tempora sint eos.
Abdul Brown,1968-02-16,SE2M 8PB,pbrown@yahoo.com,Music tutor,1995,Dolorem earum quia nobis rerum.
Alice Foster,1968-11-26,OL3R 9SP,dorothy25@hotmail.com,Plant breeder/geneticist,1981,Labore optio asperiores illo ipsa.
Paige Baker,1980-10-10,EN0N 8EG,ngoddard@gmail.com,"Development worker, international aid",1980,Temporibus eaque iure non.
Carolyn Walker,1985-05-22,NE2N 4FS,barnettdouglas@mills.com,Broadcast engineer,1987,Soluta alias nihil ipsam ea.
Duncan Barker-Davis,1994-09-07,TW7Y 1ZG,jkaur@gmail.com,Music therapist,2012,Voluptatibus dignissimos blanditiis.
Tracey Jarvis-Edwards,1984-02-04,WF74 6JN,declan68@hancock.net,Secondary school teacher,2011,Quia voluptates dicta repellat aperiam.
Ms. Carolyn Smith,1964-11-14,WA8 0RQ,matthewsjake@elliott.org,Publishing copy,1983,Quidem assumenda repellat natus saepe.
Owen Dawson,1953-11-18,M8 2AW,damianstewart@rose-holland.com,Chartered legal executive (England and Wales),1973,Fugiat sed odio.
Ashley Brown,1978-01-05,G0G 6EB,garychamberlain@hotmail.com,Adult nurse,1991,Suscipit soluta ipsa explicabo.
Wayne Burns-Wilson,1973-06-16,CO8Y 5LY,stanley23@yahoo.com,Gaffer,1993,Earum commodi eligendi.
Dylan Williams-Perkins,1966-01-03,IP2 4ZP,qhill@barker.com,English as a foreign language teacher,1972,Animi aliquid hic ea atque.
Chloe Hussain,1961-08-31,M1 1HZ,tracey40@hotmail.com,"Psychologist, clinical",1995,Fugit maxime eius nemo nemo amet.
Miss Caroline Wilson,1961-01-25,L4 5BY,lloydandrew@gmail.com,Sports development officer,2008,Aperiam est tempore nam.
Dr. Joyce Harris,1953-09-12,S71 6GJ,clarksheila@russell-cox.biz,Television/film/video producer,2016,Saepe iure dolorum.
Reece Hughes,1954-12-02,L0B 7FE,bturner@hotmail.com,Water quality scientist,1981,Suscipit itaque facilis eius.
Mr. Joseph Jones,1951-02-10,NP55 6ED,wholmes@garner.com,Oncologist,1975,Consectetur nostrum nostrum veritatis.
Kelly Kelly,1970-10-31,CR4R 6AW,bbutcher@hotmail.com,Company secretary,1974,Porro expedita officia id repellat.
Lynne Simpson,1952-04-03,W9T 0AQ,etaylor@cook-hall.com,Biomedical engineer,2018,Molestiae vitae est cum ducimus eum.
Tina Cooper,1984-05-27,L6 3LB,dconway@campbell-taylor.info,Trading standards officer,1998,Laudantium ratione architecto quia.
Joel Nash-Little,1981-11-13,N50 9ZS,tracey60@yahoo.com,"Production assistant, radio",1988,Vitae vel voluptas similique sed ipsa.
